{
  "events": [
    {
      "date": "2025-10-04",
      "date_kind": "repository_created_at",
      "id": "RepoHealth:created",
      "observed_on": "2026-10-22",
      "project": "RepoHealth",
      "source": {
        "kind": "github_repository",
        "ref": null,
        "url": "https://github.com/YRB19/repohealth"
      },
      "title": "Repository created",
      "type": "repository_created"
    },
    {
      "date": "2026-03-24",
      "date_kind": "repository_created_at",
      "id": "Finwise:created",
      "observed_on": "2026-10-22",
      "project": "Finwise",
      "source": {
        "kind": "github_repository",
        "ref": null,
        "url": "https://github.com/YRB19/Finwise"
      },
      "title": "Repository created",
      "type": "repository_created"
    },
    {
      "date": "2026-04-27",
      "date_kind": "repository_created_at",
      "id": "CosmicExplorer:created",
      "observed_on": "2026-10-22",
      "project": "CosmicExplorer",
      "source": {
        "kind": "github_repository",
        "ref": null,
        "url": "https://github.com/YRB19/Cosmic-Explorer"
      },
      "title": "Repository created",
      "type": "repository_created"
    },
    {
      "date": "2026-05-13",
      "date_kind": "repository_created_at",
      "id": "N8N-YT:created",
      "observed_on": "2026-10-22",
      "project": "N8N-YT",
      "source": {
        "kind": "github_repository",
        "ref": null,
        "url": "https://github.com/YRB19/N8N-YT"
      },
      "title": "Repository created",
      "type": "repository_created"
    },
    {
      "date": "2026-06-26",
      "date_kind": "repository_created_at",
      "id": "ResearchOS:created",
      "observed_on": "2026-10-22",
      "project": "ResearchOS",
      "source": {
        "kind": "github_repository",
        "ref": null,
        "url": "https://github.com/YRB19/ResearchOS"
      },
      "title": "Repository created",
      "type": "repository_created"
    },
    {
      "date": "2026-07-08",
      "date_kind": "repository_created_at",
      "id": "UsageOS:created",
      "observed_on": "2026-10-22",
      "project": "UsageOS",
      "source": {
        "kind": "github_repository",
        "ref": null,
        "url": "https://github.com/YRB19/UsageOS"
      },
      "title": "Repository created",
      "type": "repository_created"
    },
    {
      "date": "2026-07-11",
      "date_kind": "repository_created_at",
      "id": "ClipOS:created",
      "observed_on": "2026-10-22",
      "project": "ClipOS",
      "source": {
        "kind": "github_repository",
        "ref": null,
        "url": "https://github.com/YRB19/ClipOS"
      },
      "title": "Repository created",
      "type": "repository_created"
    },
    {
      "date": "2026-07-18",
      "date_kind": "repository_created_at",
      "id": "CompanionOS:created",
      "observed_on": "2026-10-22",
      "project": "CompanionOS",
      "source": {
        "kind": "github_repository",
        "ref": null,
        "url": "https://github.com/YRB19/CompanionOS"
      },
      "title": "Repository created",
      "type": "repository_created"
    }
  ],
  "schema": 1,
  "seeded_on": "2026-10-22",
  "seeded_projects": [
    "ClipOS",
    "CompanionOS",
    "CosmicExplorer",
    "Finwise",
    "N8N-YT",
    "RepoHealth",
    "ResearchOS",
    "UsageOS"
  ]
}
